Tweets	Country	Compound	Analysis
 How many people have Wales vaccinated I have colleagues who have to wait weeks for a vaccination in South… 	GB	0.0	Neutral
 Another excuse to get more people vaccinated	GB	0.0772	Positive
 The way out is as you said in January, when the vulnerable have been vaccinated, which they have been.… 	GB	-0.2263	Negative
Royal Caribbean: We expect all cruise guests to be vaccinated 	GB	0.0	Neutral
Covid - Concerning reports coming out on the Indian varient spreading and vaccines not working as well against this… 	GB	-0.2057	Negative
   How many deaths have so far been directly attributed to the vaccine as a %… 	GB	0.0	Neutral
  The 40% that do get covid after vaccine are less likely to be admitted to hospital and the mo… 	GB	0.1027	Positive
  She’s been fully vaccinated? So the risk is low, and therefore a poor strategy	GB	-0.7635	Negative
Royal Caribbean: We expect all cruise guests to be vaccinated  via  	GB	0.0	Neutral
  I'm pleased that I was done by 3/31 &amp; huggable by 4/15. I've been our &amp; about twice. Our t… 	GB	0.6705	Positive
 Give everyone a cash handout or coupons to get vaccinated. It's so glaringly obvious what needs to be done.	GB	0.0	Neutral
Let's take this next step safely &amp; continue to follow Covid safety measures: Hands Face↔️ Space Fresh Air🧪… 	GB	0.8074	Positive
 Not surprising,if you made it this far in a pandemic, why just take off your prevention technique? Also,… 	GB	0.0	Neutral
Gota be vaccinated to see me.	GB	0.0	Neutral
Erm, if everyone who's been vaccinated has now got a tracking microchip in their arm that's a big deal isn't it?!… 	GB	0.0	Neutral
  What does being ‘Brexit free’ mean?Come to think of it, what do you mean by ‘fully vaccinated’?	GB	0.0	Neutral
Day 1 after my Oxford jab.Other than my arm hurting where I was vaccinated I feel kind of normal.Will keep you all updated though.	GB	-0.4019	Negative
  Oh, and BTW...the risk of death was similarly very low...  	GB	-0.7184	Negative
Europe all bitter until we’re all vaccinated and getting is to go to Spain, Portugal, Greece and Malta on holiday #EUROVISION	GB	-0.0258	Negative
Any plans to allow people on immunosuppressive meds, who are fully vaccinated, to get an NHS COVID antibody test? W… 	GB	0.2263	Positive
 and look at how many people *aren't* getting vaccinated - it's going to be an abjectly brutal last stretch	GB	-0.6249	Negative
 Goodnight legends, I am offically all vaccinated 2/2 all worth it    hope you get your turn very… 	GB	0.5859	Positive
 Same here although I’m being vaccinated next Saturday. It feels like a giant relief	GB	0.6808	Positive
The UK: 0 points.The Uk Vaccinated: 32 million. Up yours Europe. #Eurovision2021 #Eurovisionuk #unitedkingdom	GB	0.0	Neutral
 B-117 “double mutant” variant. it contains two worrisome mutations in its genetic composition, which… 	GB	-0.4019	Negative
I think it’s time we pulled out of #Eurovision We are one of the main financiers! F**k ‘emJust because of brexi… 	GB	0.0	Neutral
#Eurovision let’s give points out on % of adult population vaccinated eh dickheads	GB	0.0	Neutral
  Can those who aren't vaccinated stop funding the NHS then?	GB	0.2235	Positive
_Anderson_UK  I'm 33, had both doses of Oxford vaccine. I work for NHS so was vaccinated before th… 	GB	0.0	Neutral
 Me, I'm from the UK, been fully vaccinated since early March, I work in a care home for the elderly… 	GB	0.4939	Positive
 You need to get vaccinated against that verbal a** whipping kwame brown just gave you on his live today	GB	0.0	Neutral
_londoner How fab! So glad you're vaccinated!!!	GB	0.8157	Positive
 Yeah I'm fully vaccinated now x	GB	0.296	Positive
Fully Vaccinated 2/2  I have reached a milestone this year &amp; confronted my biggest fear quite proud of myself made… 	GB	-0.0534	Negative
 _uk  Yes, I realise this is  or _uk wording.It would be les… 	GB	0.4019	Positive
 Instead they stay with the 21st, up the paranoia,  fear of variants and ask people to present for bloc… 	GB	-0.6369	Negative
  _petersen     … 	GB	0.0	Neutral
  All vaccinated people will die within 2 years.Nobel laureate Luc Montagnier has confirmed… 	GB	-0.5994	Negative
If we loosen restrictions too early, there is a real risk of a third wave in the UK | Devi Sridhar 	GB	-0.2732	Negative
 Yeah, we'll see. Let's all hope the aliens have been vaccinated.	GB	0.6249	Positive
 _uk  This is 'over 18s vaccinated' so says more about demographics than it does about 'uptake', surely?	GB	0.4404	Positive
Fully vaccinated is a myth. Both doses give you between 95-99% immunity 	GB	0.0	Neutral
 All vaccinated people will die within 2 years.Nobel laureate Luc Montagnier has confirmed that there is no c… 	GB	-0.7269	Negative
 How can 'vaccines'* be the way out if you can still get &amp; spread covid when you have been 'vaccinated'?* a… 	GB	0.0	Neutral
 Have they all been vaccinated though, and have they downloaded the NHS app with the amazing face-recognition Dan?	GB	0.5859	Positive
FULLY VACCINATED  	GB	0.0	Neutral
Our Esteemed Patron, Shaykh Muhammad Al-Yaqoubi encourages Muslim communities to get vaccinated in order to protect… 	GB	0.7003	Positive
Vaccinated 232 people today  my most in one day before that was 126  have never felt so tired in my life 🤣🤣	GB	-0.5777	Negative
Huffpost attempting to make out  Corbyn is some kind of anti-vaxxer while he's also head of a project aimed at gett… 	GB	0.0	Neutral
 Taking them to school as well, theynever signed up for that, and having them vaccinated  some of this “modern” thinking 	GB	0.2732	Positive
According to his biography, Tony did have Leo vaccinated with MMR. I have no reason to believe he was lying.Sayin… 	GB	-0.296	Negative
Tony Blair refused to say whether Leo had been vaccinated at the height of the MMR crisis, citing privacy and medic… 	GB	-0.743	Negative
 Fully vaccinated,wearing masks to protect others (such as the immunocompromised and infants). I’ve… 	GB	0.3818	Positive
"The ""designer"" face mask company sponsored by Meghan is going bust after USA now advise against wearing masks if va… "	GB	0.0	Neutral
SHES FULLY VACCINATED BITCHESSSSS 	GB	0.0	Neutral
Great thread from  also highlighting why the messaging of the vaccine being ‘our way out of the pandemic… 	GB	0.6249	Positive
Fully vaccinated! Big thank you to our amazing NHS, the vaccination teams and volunteers that are helping the vacci… 	GB	0.8424	Positive
 No need for more jabs then If this drop is due to the Jabs. Job is done. Obviously those unvaccinat… 	GB	-0.5537	Negative
   It has an average age of death of 80 so now the elderly and vulnerable are v… 	GB	-0.7003	Negative
mans 50% vaccinated wys x	GB	0.0	Neutral
i am now fully vaccinated 	GB	0.0	Neutral
   ..of the best Christians I know. To look after your neighbour and your frien… 	GB	0.6369	Positive
 I’ll let you know after Monday’s game. Although it worked pretty well today in the Holte Suite when getting vaccinated!	GB	0.68	Positive
I wanna get vaccinated 	GB	0.0	Neutral
Fully vaccinated after just asking if they had any spare. 	GB	0.0	Neutral
 I’m so sorry and bewildered as to why this would happen, I am working in a vaccination hub in Leicester and… 	GB	-0.1513	Negative
 Haha thanks  will tell him! I hope so. Didn't feel comfortable with the idea of eating inside as th… 	GB	0.7291	Positive
    ....being vaccinated as a younger person doesn't prevent, but… 	GB	-0.0191	Negative
    I will try to explain. First some people with certain conditio… 	GB	0.2732	Positive
   Didn't Jesus teach you to protect others? That is the main reason for your a… 	GB	0.3818	Positive
Fully vaccinated. Thank you NHS, much love x	GB	0.7893	Positive
I’m a primary school teacher technically risking my life everyday, yet I’m going to be one of the last to be vaccinated because of my age.	GB	-0.3182	Negative
Just had my second dose of Astra Zenica. Please please please sign up and get vaccinated, it's just Common Sense.… 	GB	0.7096	Positive
Vaccine 1 done.  Millennium Point vaccine centre was a dream ❤️ #vaccinated #NHSCOVIDVaccine 	GB	0.25	Positive
"So I'm guessing that tomorrow's excuse for another UK Eurovision failure - following 10 years of ""the Iraq War"" and… "	GB	-0.7845	Negative
Vaccinated  Please be kind side effects!! 	GB	0.7418	Positive
Double vaccinated baby! #thankyouNHS 	GB	0.0	Neutral
 Reality is that in a vaccinated population it doesn’t matterThose that choose to exercise their right to… 	GB	0.0	Neutral
All of maskless staged press photos are from months ago by the way, when Covid levels were much higher and almost n… 	GB	0.0	Neutral
Now full vaccinated, didn’t need a day off work and managed to do all the things I would have done post vaccination… 	GB	0.0	Neutral
Double vaccinated. Thank you   	GB	0.3612	Positive
Tribute to all #NHSCOVIDVaccine roll out staff many giving of their time and the volunteers making sure the roll ou… 	GB	0.5719	Positive
Aaaand..... that’s it! Done ✅ #vaccinated 	GB	0.0	Neutral
I've said before I wouldnt terminate a relationship over the vaccine... That comes with an important caveat, I woul… 	GB	0.2023	Positive
" Right, James. Really sick. They are ""claiming"" that it is their deliberate intention to infect unvacci… "	GB	-0.5563	Negative
Well that’s me fully vaccinated #vaccinated #COVIDVaccination #thankyouNHS 	GB	0.2732	Positive
_Sorry Your Japanese Covid data is a tad out of date, cases and deaths are on the rise and only 3% are vaccinated.	GB	0.0	Neutral
Just had my second vaccination for #COVID19 #phiser Jab…we all have a duty to get vaccinated 	GB	0.0	Neutral
  Over 30s are being vaccinated at the same time as over 50s now to accelerate protection. Great news	GB	0.6249	Positive
_mind I am now a partially vaccinated bitch 	GB	-0.5859	Negative
 Family member got vaccinated at Westminster abbey this week ffs!!🤷‍♂️	GB	0.0	Neutral
 The stats should be available on how many of the fully vaccinated people having to quarantine for… 	GB	0.0	Neutral
If I have to get vaccinated, there was only one place I was going to go! Hats off to all involved superbly organise… 	GB	0.0	Neutral
More than 4 in 10 people now vaccinated against #COVID19 in England.	GB	0.0	Neutral
Vaccinated yesterday. 	GB	0.0	Neutral
Fully vaccinated!!  Feeling grateful as so many didn't get the chance to be protected. #vaccinated #AstraZenaca #grateful #Thankful	GB	0.7774	Positive
 Have you got a NHS registration number? If you find the NHS COVID booking system and put your registrati… 	GB	0.0772	Positive
     I’m not an expert but one of the crite… 	GB	0.0	Neutral
 There will be a third wave and said wave will be blamed exclusively on those of us who have not had… 	GB	-0.4767	Negative
 The really sad thing about this, is that, the plan is to kill off you vaccinated people 	GB	-0.8439	Negative
Well that’s me all vaxed up!  Just waiting to get the nod for a holiday in Italy #CovidVaccine #vaccinated	GB	0.6239	Positive
Join the millions already vaccinated against Covid-19. You'll be notified when it's your turn to have the vaccine.… 	GB	0.296	Positive
 Yes it’s only a small firm. Got a few young lads not vaccinated yet to. Can’t blame him really	GB	0.0772	Positive
 Stephen merchant vaccinated you fair play	GB	0.5719	Positive
Ya girl is fully vaccinated. I love our NHS	GB	0.6682	Positive
After 4 months of trying to get vaccinated, I've got a call today that I can do it on Monday because I'm suddenly i… 	GB	0.0	Neutral
After rescheduling I’ve now been Pfizered! #vaccinated	GB	0.0	Neutral
Woo hoo, fully vaccinatedWell until boosters, but I'm chuffed 	GB	0.2617	Positive
'Orders of Magnitude Higher Deaths in the Vaccinated': Israel's Vaccine Data Reveals a Frightening Picture… 	GB	-0.4939	Negative
White House teams up with dating apps to give vaccinated users free perks – TechCrunch -  	GB	0.5106	Positive
   Well it would potentially be a worse illness but if its coning from a v… 	GB	-0.3291	Negative
Highlight of my morning...getting #vaccinated .Highlight of everyone else at the velodrome this morning...seeing so… 	GB	0.5859	Positive
And because of this I may be the first person to get vaccinated while listening to Bikini Kill. At least I hope so.	GB	-0.4215	Negative
 It has always been the case that service personnel had to be vaccinated if it was considered necessary… 	GB	0.0	Neutral
   We will see what occurs when the Vaccinated meet with the Coronavirus'   Ho… 	GB	0.0	Neutral
    Obviously on YouTube and other sources u think sky news are going to put t… 	GB	0.0	Neutral
Every vaccination gives us hope. When it’s your turn, join the millions of people already vaccinated, to protect yo… 	GB	0.7717	Positive
  So, no facts to prove kids need to be vaccinated. I did say, do not @ me.	GB	-0.3597	Negative
Ok this is getting a bit ridiculous now, ain’t no one falling for this shit. What fucking variant next? The london… 	GB	-0.7717	Negative
_nffc Lock us down until we learn to behave, get vaccinated and beat this virus	GB	0.0	Neutral
   You can still get it after full vaccination but if its from someone els… 	GB	0.0	Neutral
Just got my second Oxford AZ #vaccine So fully vaccinated!! Superbly organisation by . Literally 5 m… 	GB	0.0	Neutral
That moment you realise your friends are all children because none of them have been vaccinated.  	GB	0.4767	Positive
Let's keep going with the #CovidVaccine in #Leicestershire - being fully vaccinated, with both doses, will increase… 	GB	0.0	Neutral
This is beautiful but why are only the children allowed to sing together? Most of our choir has had one vaccination… 	GB	0.3506	Positive
My dad already vaccinated 🥳🥳🤩	GB	0.0	Neutral
  Could you please explain and give facts as to why children need to be vaccinated?	GB	0.3182	Positive
_      Commonly? I thought CVST was suppo… 	GB	0.0	Neutral
Both vaccines done. This is the only vaccine I have had in my whole life, I was never vaccinated as a child and I’m… 	GB	0.0	Neutral
Your phone, computer and other devices get constant security updates.This is your bodies security update.… 	GB	0.5859	Positive
✌️ Remember to #CheckforCovid twice a week with a home test kit ✌️ 1 in 3 people  have no symptoms so can still p… 	GB	-0.296	Negative
 No panic as long as we get people double vaccinated sharpish. It's just a maths problem. 40% of peo… 	GB	-0.802	Negative
My arm hurts where I got vaccinated every time I lift itSo, I've stopped lifting it 	GB	-0.6124	Negative
Fully vaccinated  	GB	0.0	Neutral
 When I am vaccinated I am wearing a mask because I have had Covid and I have long term damage from… 	GB	-0.4939	Negative
 Get vaccinated. That is the message.	GB	0.0	Neutral
UK: &gt;40% fully vaccinatedAustralia: &lt;7% vaccinatedUK: no more than 10k fans in #PremierLeague stadiumsAustral… 	GB	-0.296	Negative
But people fully vaccinated with AZ have died. That is an indisputable fact. 	GB	-0.5574	Negative
  Genuinely nobody cares a rats ass about whether I’ve been vaccinated or not. Either thst… 	GB	-0.128	Negative
Out last night celebrating the publication of #governorsman with socially-distanced vaccinated and tested friends.… 	GB	0.5719	Positive
"""Medical experts say that a vaccinated person cannot ‘shed’ vaccine spike proteins""  "	GB	0.0	Neutral
 at this rate, another 10 million (approx) vaccinated before June 21st, vaccine works against it, and… 	GB	0.0	Neutral
  Exactly. Which is why we need everyone to be vaccinated.	GB	0.0	Neutral
 Etsy :) search vaccinated lol	GB	0.7003	Positive
 Got to keep the narrative going, got to keep the sheeple terrified, got to push vaccinated against… 	GB	-0.6124	Negative
 Yep, hadn’t heard anything on this. I’m fully vaccinated and my wife will be soon, so thought we may… 	GB	0.296	Positive
Whether or Corbyn has had his vaccine is a matter that reflects on his character, common sense &amp; sense of duty. But… 	GB	0.0258	Positive
 Hahahaha and you vaccinated thought you was getting some freedom back 🤡🤡	GB	0.6369	Positive
Bahrain is now devastated by virus waves, despite having vaccinated almost everyone with the Chinese vaccine. Same… 	GB	-0.6124	Negative
 I'm only considering number of vaccinated. Probably the UK will get higher numbers by not enforcing disc… 	GB	0.0772	Positive
I really dont care if Corbyn's been vaccinated, however I do think that he should tell us. Only because his base is… 	GB	-0.4416	Negative
 I’m sorry to hear about your bunny! Did you know if they were vaccinated at all? and is your other b… 	GB	-0.1511	Negative
12 fully #vaccinated die of #coronavirus 	GB	-0.6344	Negative
Vaccines booked. Double vaccinated 4 days before the start of the season  ⚽️ 	GB	0.0	Neutral
 Not everyone will be vaccinated globally for lots of reasons. The old normal - 2019- has gone forever. W… 	GB	0.0	Neutral
Found out yesterday I've been vaccinated since December when I was unblinded from the trial I'm taking part in  	GB	0.0	Neutral
By failing to ramp up vaccination more rapidly, we are dividing the world between the rich and vaccinated who will… 	GB	0.0772	Positive
For a moment I thought you were also gonna do that Magnet stunt  at your vaccinated arm.  	GB	0.0	Neutral
 is there any provisions for. Indians in Nepal to get vaccinated?	GB	0.0	Neutral
   _NN  You seem to not like what I tweet and are trying t… 	GB	-0.2755	Negative
OkCupid launches ‘I’m Vaccinated’ badges in time for hot vaxxed summer 	GB	0.0	Neutral
Well I'm now fully vaccinated, had my second shot yesterday	GB	0.2732	Positive
 Although they might be fully vaccinated they're just as bad as Republicans at stopping covid from sprea… 	GB	-0.6249	Negative
Today (5/23) @ noon on :  Pro Tem  on session strides;… 	GB	0.0	Neutral
More evidence of the importance of vaccination to minimise the harm caused by Covid-19. Hands face space ventilatio… 	GB	-0.25	Negative
 True, but that doesn’t take away from the fact that far more deaths have been reported than any vaccine be… 	GB	0.2263	Positive
  It still seems reasonable that many people do not know what vaccine or what batch t… 	GB	0.0	Neutral
  Or the success of our vaccine program :-)	GB	0.7184	Positive
 Pure vaccine envy kicks in	GB	-0.2732	Negative
_Blue The government has realised that miraculously they got away with their negligence and self serving… 	GB	0.0	Neutral
If you are over the age of 40, you can get your first #CovidVaccine today at Bedworth Civic Hall's walk-in clinic b… 	GB	0.0	Neutral
Black, Minority and other ethic people Living in #Nottingham #Nottinghamshire . Have you had the COVID vaccine yet?… 	GB	0.0	Neutral
Herd imuitty jenny explain to Andrew marr what this means but he still carry on asking the questionIts si… 	GB	0.0	Neutral
_Vanessa It's not been well explained at all. The threshold for an effective vaccine is 50% apparently. The AZ… 	GB	0.3151	Positive
Had my second Oxford #vaccine on Friday. Felt awful yesterday, chills, sweats, headache, wiped out...but still feel… 	GB	-0.4588	Negative
   _Grennan It’s not 1 thing against the Gov though, it’s many things they… 	GB	0.0	Neutral
 If vaccine was efficient then surely you wouldn't be surge testing/contact tracing.  Just saying 🤷	GB	0.6908	Positive
 Another celeb pic having the vaccine! 	GB	0.0	Neutral
     We need an anti-tory vaccine that simply opens up p… 	GB	0.0	Neutral
 Oh for goodness sake so 70% of the UK population are due to die imminently from the vaccine? Look I suppo… 	GB	-0.2263	Negative
 Plus vaccine shaming of course.	GB	0.0	Neutral
 We just cut more of your vaccine supplies 🤣🤣 #sorelosers	GB	-0.2732	Negative
Disingenuous from BBW and the Telegraph.  #Covid19UK #privacy #dataprotectionSPI-B paper f… 	GB	0.0	Neutral
Covid vaccine status feature on NHS app reveals plans for domestic use  via … 	GB	0.0	Neutral
 _there You can tell by the language this is an anti-vac site so not clear if this is true. It c… 	GB	0.0869	Positive
 And she is 100% correct, hundreds are now in hospital with AVRs and vaccine induced covid-19, do not beli… 	GB	0.0	Neutral
Celebrity releases new protocols for summer cruises with new mask, excursion, and vaccine rules - Cruise Blog 	GB	0.0	Neutral
1st dose done!!! the whole process was smooth like butter Everyone make sure you have a vaccine when you can! pr… 	GB	0.7156	Positive
 _45 We would certainly limit the frequency, scale and severity of outbreaks. Alas poor vaccine cover… 	GB	-0.4215	Negative
This is good news. If you are someone who is still hesitant about the #COVID19 vaccine. Please read this… 	GB	0.4939	Positive
 _in_EU No, I don’t feel trapped. I feel bloody angry that there are so many dumb/greedy/bra… 	GB	-0.8957	Negative
_Sked Oh mate. Put that into my veins right now!! And then after the pub crawl has safely moved around my circ… 	GB	0.5837	Positive
 Not one single vote. Don't they realise who created the Corona vaccine. Make their own from now on.	GB	0.25	Positive
 @_AgainstMyWill 2/ about winter and the probability of her getting a cold. I definitely won't be let… 	GB	0.4019	Positive
_Sked Grand Vaccine Day Out?!	GB	0.5093	Positive
After several months of Covid vaccine rollout, I am still amazed by the fact that more than 2% of adults in the UK… 	GB	0.4939	Positive
 Get your first shot, get your  second, get ready for your third. Whilst still having testsAnd you all thin… 	GB	0.3612	Positive
  I meant long before she even had the vaccine. Don't you realise for 90% of people co… 	GB	0.0	Neutral
Jenny Harries clearly was not entirely truthful in saying that AZ was just given to groups that couldn’t go to vacc… 	GB	0.0008	Positive
Had my questionnaire for the youth final tomorrow. Amazed that it’s just a tick box thing and nothing about tests o… 	GB	0.4939	Positive
How tragically stupid do you have to be to think your covid vaccine is magnetic?	GB	-0.7964	Negative
 Yes, fuck that Les,  we've had the vaccine	GB	-0.2023	Negative
    What sort of 'severe vaccine effects' have they had ?	GB	-0.4391	Negative
  think Europe's got the arse over the vaccine.....	GB	0.0	Neutral
No one is safe until we are all safe. Vaccine redistribution and a global mindset necessary. Emphasise ventilation.… 	GB	0.5574	Positive
 Oh extremist views anywhere are vile! Look at the anti vaccine protests ! People claiming the govt w… 	GB	-0.8353	Negative
 I'm most concerned about my 17 year old with no vaccine in sight. And all her friends. And the 1200 kid… 	GB	0.2263	Positive
Patel on 21 June re-opening: “the data is good and we also need to carry on being conscientious in our behaviours”… 	GB	0.4404	Positive
   As someone who hasn’t had the vaccine yet it’s at least made my decision which o… 	GB	0.0	Neutral
First dose of vaccine ✅ Nice ride along the A38 blue route into town to get to Millennium Point. Very efficient sys… 	GB	0.7089	Positive
 'Ptizer'? You got the orange flavour vaccine?	GB	0.0	Neutral
𝐇𝐚𝐯𝐢𝐧𝐠 𝐅𝐮𝐧 𝐰𝐢𝐭𝐡 𝐇𝐚𝐫𝐫𝐲 𝐒𝐡𝐚𝐰Great to see our passengers enjoying a well earned seaside break this week joined by… 	GB	0.6705	Positive
   _uk the great British Oxford az vaccine will be the number one choice o… 	GB	0.6597	Positive
Had 3 separate text messages from Swiftqueue changing my vaccine appointment, even though I was fine with the one I… 	GB	0.2023	Positive
On 1st June I will get my 2nd dose.I will be having Oxford AstraZenica.I am not worried about blood clots, microc… 	GB	0.2235	Positive
The ques  I’m seeing for the vaccine are ridiculous	GB	-0.3612	Negative
  No culling the population, this is why the experts said don't spread out the doses as i… 	GB	-0.296	Negative
First Covid vaccine received! Thanks all   for the friendly and great service! See you all for my second jab! 	GB	0.9017	Positive
 Reality is Scotland vaccine roll out is average, Wales is much the same, look at the numbers not the perc… 	GB	0.0	Neutral
 I know no one who received a second dose of the AZ vaccine after 28 days. How has PHE come to this concl… 	GB	-0.296	Negative
  Uk need to pull out. Whole thing is a absolute shambles! If countries hate us that much… 	GB	-0.6114	Negative
 My mother didn't survive being in an iron lung. ️I stood in line for my sugar cubes decades ago.I… 	GB	0.0	Neutral
 Feeling particularly well thank you, upbeat and recovered after 8 dreadful weeks of a vaccine reac… 	GB	0.4159	Positive
  Completely agree James, but I do wish that  would wake up to this very fact… 	GB	0.6648	Positive
 I didn’t get a sticker. I was so elated to have the vaccine that I was back in my car for the 15 minut… 	GB	0.7481	Positive
My sister had a #Stroke in March at the age of 42. She had #Covid before Xmas &amp; had her 1st #AstraZeneca vaccine 10… 	GB	0.0	Neutral
" After Covid first wave, Central Govt was exporting Vaccines and Boasting around the world ""Indian Made… "	GB	0.0	Neutral
When you book your vaccine appointment . You get an option if you want to go to the same place for 2nd dose . I cli… 	GB	0.0772	Positive
 We'll all be on the Soylent Green by the end of the year. With photo ID vaccine passports so we can queue up for it...	GB	0.0	Neutral
 its people's choice to have a vaccine or not	GB	0.0	Neutral
    Does it matter what the % is? If it killed one person that’s enough what’s… 	GB	-0.6597	Negative
#Corona #vaccine #VaccinesWork #vaccinate #learntherisk review some unintended consequences 	GB	0.0	Neutral
Have you had your covid vaccine? As soon as you're offered your vaccine, it's important that you get your first… 	GB	0.2023	Positive
Have you had your covid vaccine? It's important to arrange to get your first jab as soon as you are invited &amp; en… 	GB	0.2023	Positive
