Tweets	Country	Compound	Analysis
 Fucking farage &amp; johnson promised us 350 million Eurovision votes, it was even on a bus 	GB	0.3612	Positive
  It will just be us and the Auzzies, but the deal will be that all the points have to g… 	GB	0.0	Neutral
 Dominic Cummings, Nigel Farage, Boris Johnson, Michael Gove. Your boys took one hell of a beating	GB	-0.8225	Negative
 We got Boris Johnson as a PM	GB	0.0	Neutral
 Johnson will be telling us we won tomorrow and a large percentage of the country will believe him	GB	0.5719	Positive
Johnson you get zero points	GB	0.0	Neutral
Bless James Newman. Political voting at its finest. Should make Farage or Johnson do it next year #Eurovision	GB	0.4215	Positive
Old fatboy Johnson needs to look at this vote. We are the most hated country in europe. Expect a declaration of war… 	GB	-0.6697	Negative
Do we have a point yet? Nope, didn't think so. They hate us. Unsurprisingly. Because why wouldnt you hate Boris Joh… 	GB	-0.8384	Negative
#Eurovision The whole of Europe rightly hates us ! ( Thanks to Johnson. )	GB	0.0	Neutral
  Then what? Gove? Didn't Johnson always want to go after he got his Brexit over the l… 	GB	-0.1486	Negative
_WhiteheadUK Even though I’m left of centre &amp; can’t be doing with Johnson i do think that all MPs &amp; ministers sh… 	GB	0.0	Neutral
_r You mean the Home Secretary on her eyebrows and the Prime Minister,Boris Johnson when he was having an affair.	GB	0.0	Neutral
 I wonder what boris johnson listens to	GB	0.0	Neutral
 Well at least Pearl Carr (with hubby Teddy Johnson) came second with their nonsensical Little Bird… 	GB	0.2732	Positive
 Johnson, Hancock and Patel turn on you eat you alive. They grind your bones to dust in their mouth… 	GB	0.3818	Positive
I am Boris Johnson 	GB	0.0	Neutral
Now playing Damo Funk Kinobi and tHE tEMPLE oF gROOVE #8 Part 2 by Damo Funk Kinobi in da mix feat. Block &amp; Crown,… 	GB	-0.2732	Negative
 9 points increase.  I think Cummings is going to drop the bomb that the Barnard Castle story was Johnson's idea	GB	0.6369	Positive
I’m not watching #Eurovision as I find the voting often political and not based on merit. I first watched it in 195… 	GB	-0.3252	Negative
21 Mark Gilbank survives a last bender from 4 Dan Johnson to win the #BriscaF1 Final.#1 3rd, 197 4th	GB	0.5859	Positive
 You’re right there Matthew. 🤷I’m immune now, I’ve given up being upset. #safcMajority are out o… 	GB	-0.1027	Negative
 Record to date:Fishing, screwedFinance, screwedFarming, screwed!When is Johnson going to F off?!!!	GB	0.0	Neutral
 I think  I have every time I see Johnson or his hapless government .	GB	-0.34	Negative
I'll tell you something REAL.. Johnson, Hancock, Whitty, Valance &amp; Co have absolutely NOT felt true PAIN such as th… 	GB	0.1652	Positive
 Johnson's whole cabinet illustrates the folly of appointing in the basis of personal loyalty rather than capability.	GB	0.5423	Positive
Anyone else old enough to remember Pearl Carr &amp; Teddy Johnson at #Eurovision ?1950something in b/w. 	GB	0.0	Neutral
 The scientific data doesn’t fit the political narrative of this government. We need to wake up and see… 	GB	0.3612	Positive
   Actually Johnson &amp; Johnson is bisexual and was married to the Tiger King. 	GB	0.0	Neutral
" I'm glad you mentioned ""standing together against evil"" Mister Johnson. "	GB	-0.34	Negative
75 million claps? That’s brilliant. Almost as much as Boris Johnson wants to pay a nurse. #Eurovision	GB	0.5267	Positive
 Wasn't Johnson being a deceitful journalist back then?	GB	0.3412	Positive
 I thought it was more our recruitment the summer after this game, we signed a player who was on loan al… 	GB	0.0	Neutral
Well its happened Johnson v Jordan Gabriel in the league 1 play off final #nffc	GB	0.5423	Positive
Johnson vs Gabriel, can’t wait to see this #NFFC #IMPS #UTMP 	GB	0.0	Neutral
Cummings’s trip to Barnard Castle may actually play into the Govnt’s hands if he chooses to release any troubling d… 	GB	-0.2732	Negative
Starting to watch New Girl again… it’s reminded me that Jake Johnson is my spirit animal.	GB	0.1779	Positive
 Just doused myself with Holy Water and visited the Mail. Every comment on the free takeaways slagged Johnson to the rafters.	GB	0.5106	Positive
Why on Earth would anyone in a “red wall” constituency even think that voting Conservative was ever a good idea? Jo… 	GB	0.4404	Positive
Do Johnson and Symonds pay for anything? #freeloaders 	GB	-0.1027	Negative
So glad that collectively the human race is slowly but surely replacing Dwayne Johnson with Dave Bautista.	GB	0.7181	Positive
_Steve Johnson's face!	GB	0.0	Neutral
  The concept of Johnson ever cooking is hilarious!	GB	0.4574	Positive
Boris Johnson &amp; The Indian Variant: Third Wave Incoming? | DDN Live  via 	GB	0.0	Neutral
_again I do not like any of the aforementioned but I loathe Johnson so bring it on, pass the popcorn.	GB	-0.7055	Negative
 Boris Johnson and his cabinet should resign, but that’ll never happen and the BBC will never report their corruption.	GB	-0.1779	Negative
Be Phone Banking From Next Month For Labour.Let’s Get Boris Johnson and The Tories Out.	GB	0.0	Neutral
 Bradley Johnson 	GB	0.0	Neutral
  Johnson’s version of a food bank	GB	0.0	Neutral
 Yes.  The problem now is, Johnson's inactivity is going to cause British companies huge problems.	GB	-0.1027	Negative
  Nobody really likes Lee Johnson 🤷‍♀️	GB	0.4754	Positive
  I had eight pints of bitter and a dodgy kebab last night so if Matt Hancock and Boris J… 	GB	-0.5719	Negative
4 Dan Johnson wins #BriscaF1 Heat 1215 lead with 3 to go until he collected a stationery car at T4.	GB	0.5719	Positive
  _jamescheese Well it certainly wasn't Labour and remain who lied to everyone about Br… 	GB	0.2263	Positive
 Everything, simply everything around Johnson is completely chaotic!	GB	-0.5838	Negative
  Never johnson	GB	0.0	Neutral
 How about give us ALL our freedoms back Mr Johnson this government is taking the piss now !!!!	GB	-0.3956	Negative
"   Boris ""Minister for the Union"" Johnson is no English nationalist."	GB	-0.296	Negative
 Boris Johnson is coming.	GB	0.0	Neutral
Brennan Johnson’s Imps or Jordan Gabriel’s tangerines, whoever the fuck it is get me in that away end	GB	-0.5423	Negative
_ I can’t stand Lee Johnson at all so I’m delighted 	GB	0.5542	Positive
If Cummings does hit out at Johnson this week at committee, it won't help the June 21st date. If he blames Boris fo… 	GB	-0.607	Negative
 Everything around Johnson is chaos! Everything!	GB	-0.6467	Negative
Honourable Ben a Johnson tagged me in one of those four photos things. I’m old and don’t fully understand but here… 	GB	0.2617	Positive
Honestly I don't know why he bothers with the bicycle helmet. He is shaped like a Weeble! He'll wobble a bit, espec… 	GB	0.6114	Positive
 Lad I might be wrong but lee Johnson doesn’t seem the type to kick players out which is what you do n… 	GB	-0.2617	Negative
_Hunt 1/3 with ongoing restrictions, masks, distancing. You can’t have much faith in the vx yourself. If you… 	GB	0.4215	Positive
Tomorrow I’ve my second dose () but this time I’m worried about side effects. Just because on Tuesday I have t… 	GB	-0.4215	Negative
 I didn’t even feel it, and I took paracetamol when I got home and had basically no side effects. No ar… 	GB	-0.5267	Negative
2nd COVID jab done (Isn't Bill Gates wonderful), no side effects. Must. Buy. More. Microsoft. Products. Must. Buy.… 	GB	-0.296	Negative
   There are side effects with all medicines/drugs, on this occasion, the… 	GB	0.0	Neutral
The Cowin portal has an email on its FAQ page to report the side effects  (Helpline Email Id: nvoc2019[at]gov[dot]i… 	GB	0.0	Neutral
Looks like I’ve been very lucky, two days post vaccination and I’ve had no side effects. A couple of friends had de… 	GB	0.7574	Positive
My girlfriend got her 2nd #NHSCOVIDVaccine yesterday. #OxfordAstraZeneca again no side effects ✊	GB	-0.296	Negative
 The times I’ve been to the US, the adverts have been about anti-depressants. After you read the side… 	GB	0.0	Neutral
Double jabbed 1st jab had common side effects plus 10 days CFS related PEM.2nd jab had headaches but nothing… 	GB	0.0	Neutral
_ff Because I’m NHS, I had the Astra Zeneca one ages ago, way before they decided I shouldn’t have had it. No… 	GB	0.0	Neutral
 It’s unbelievable that this study even needs to be done. Having issues with your identity is a psycho… 	GB	0.2023	Positive
No real side effects from the jab so far. Apart from feeling extremely tired earlier and having a nap. And a sore/t… 	GB	-0.5984	Negative
 Thank you!  How were your side effects &amp; how long did they last?	GB	0.4199	Positive
 Glad to hear you haven't suffered too much form side effects. Thank you, will need it 	GB	0.798	Positive
 Ooh, hope no side effects for you! I have my first in just over a week  watching #eurovision just… 	GB	0.2481	Positive
 You are only in 2.5 currently then so should be free of interference.Had my 2nd AZ last Sunday, no s… 	GB	0.3321	Positive
 I got no side effects from the second jab. Took some paracetamol throughout the day though so that could have helped.	GB	-0.296	Negative
I feel watching  #GER entry that my second jab side effects have kicked in #Eurovision	GB	0.0	Neutral
Do the vaccine side effects involve hallucinations? Because I think they might have just set in #ger #Eurovision	GB	0.0	Neutral
 Definitely - not everyone has side effects so hopefully you’ll be lucky.	GB	0.8398	Positive
_nara    The numbers of post-vaccination deaths and serious side-effects tends to argue against that.	GB	-0.4019	Negative
 _iceburg  Can't watch that right now but anecdotes only inform what to look… 	GB	0.0	Neutral
_alex Side effects kicked in yet?	GB	0.0	Neutral
Subjects report feelings of joy and satiation. Side effects include salivation, and in extreme cases, instances of… 	GB	0.5859	Positive
 Me too my arms aching but at the moment that’s it side effects wise	GB	0.4678	Positive
 Do you know which one you’re getting dude? If it’s AZ, I’d recommend taking paracetamol from a couple o… 	GB	0.3612	Positive
_Pine I had side effects, it was rubbish, would still rather that than getting Covid. Short term pain for long term gain. 🤷‍♀️	GB	0.0258	Positive
_iceburg   So you know that yellow card reports are NOT reports of vaccine side effects then?	GB	0.0	Neutral
  Same as flu jab but more side effects. Your child stands a 99.97 chance of dying from some… 	GB	0.1779	Positive
 _Gypsy_Jew See? It’s so wrong! As if 12 years olds are going to research the ingredients and pos… 	GB	-0.6466	Negative
 I hope you have no side effects Tracey and it sounds lovely where you live. I would love it there xx	GB	0.8658	Positive
...and no side effects #getvaccinated	GB	-0.296	Negative
So the side effects from the second jab of AstraZeneca are meant to be less bad... I’m six hours post jab and feel… 	GB	0.0	Neutral
 Excellent film as is (apart from the monster, obviously). But, IMHO, one which could be remade now… 	GB	0.5719	Positive
“We’ve never seen this level of side effects for any vaccine without the FDA taking action,” stated Dr. Angelina Fa… 	GB	0.0	Neutral
  Thanks MichaelThats convinced me to go have the jab a couple of years before the clinica… 	GB	0.6808	Positive
That weird moment when the vein on the left side of your head is pulsing crazy and you can literally hear sound effects.	GB	-0.4767	Negative
 So pleased you’re all ok now Helen. I had a very impressive immune response to the first vaccinati… 	GB	0.8876	Positive
Had my second Covid jab yesterday. Pleased to report the side effects are non-existent this time, which is nice as… 	GB	0.6908	Positive
Side effects: a small cry.I know we’re a long way from out of the woods; and I know human beings can be unimagina… 	GB	0.0	Neutral
 Had my 2nd a week ago, no real side effects like the 1st, my arm didn’t ache that much as well.	GB	-0.0516	Negative
 One of our volunteers had an allergic reaction to the first dose but as far as I know was absolutel… 	GB	-0.1531	Negative
Over two days since our vaccine and I am just starting to feel like I did the last time.  Hope the side effects are… 	GB	0.6597	Positive
 same here, I have been for a few weeks now. First jab, nearly the whole hog of side effects and aching… 	GB	0.0	Neutral
_lou Rest up Lou, hope you have very little side effects 🤞	GB	0.4404	Positive
Second jab done. 🤞 side effects are not as bad this time. But hey it's worth it! #GetVaccinated  	GB	0.6177	Positive
 Same one as I had.Just had a bit of a headache that day and a sore arm for a couple of days Hopefully… 	GB	-0.3612	Negative
 Nearly 38 million have had the vacine in this Country with only a tiny % of adverse side effects!	GB	-0.4199	Negative
No real side effects to report. Slightly sore arm and a bit tired...though the latter it probably more down to the… 	GB	-0.5279	Negative
_Wildfire Look after yourself within the next 24 hours for potential side effects, after that you’ll be as bright as rain	GB	0.4404	Positive
Had my second AstraZeneca jab yesterday. Zero side effects, feeling great! ☺️#AstraZeneca #NHS #CovidVaccine… 	GB	0.7088	Positive
 Yes. Just hoping no side effects this time.	GB	0.5106	Positive
 🤞for an easing of side effects today.	GB	0.25	Positive
 Such good news! I have my second next week. Hope you have a good weekend and no side effects. It seems… 	GB	0.7777	Positive
First the Indian Variant, then the Yorkshire Variant and now the Ditton Priors Variant. Side effects are massive fe… 	GB	0.0	Neutral
  had mine Thursday, no side effects at all..	GB	-0.296	Negative
 I was fortunate to not have any side effects. Get the paracetamols down you and drink plenty of water 	GB	0.4404	Positive
"Try high dose ""allopathy"" for 1year especially steroids/insulins/cancer medicines etc. With kind of side effects/re… "	GB	0.0	Neutral
  Yeah I had covid last year. Brutal. It was just the fact that it’s Saturday and had the j… 	GB	-0.4404	Negative
 I had mine two days ago. Only side effects of #PfizerVaccine is sore arm. Was my first vaccine 	GB	-0.3612	Negative
 The trouble is you can keep showing these people evidence and they choose to sweep it aside, with disb… 	GB	-0.4019	Negative
At least the side effects from my second vaccine left it until the end of the show to kick in 🥵🥶🥱 Glad to be home … 	GB	0.4588	Positive
 Fingers crossed you get no side effects brother. I was rough from the Oxford one	GB	-0.296	Negative
 Any side effects? When I had my first jab I felt a bit lethargic for the day but nothing serious… nothing… 	GB	-0.1531	Negative
Revising for the FRCS and I’m sure I’d be laughed off the UTI station if I said an antibiotic had these side effect… 	GB	0.6486	Positive
Only side effects so far have been a sore arm, and I’m now very tired. Considering myself lucky, and heading to bed early tonight.	GB	-0.4391	Negative
  That vaccine took the form of a neutralised culture of the actual virus. The duration… 	GB	0.0	Neutral
 Will be watching out for my wife then, she had that one. She went through the side effects list and was like 🤢	GB	0.3612	Positive
 I'm alright thank you, had me covid jab today at 12 so just waiting to see if I get any side effec… 	GB	0.5423	Positive
 Well, least your vaccinated now. It might be something to call the GP about or these is a number and we… 	GB	0.34	Positive
 have you had COVID-19? I've heard (anecdotally) that people get fewer side effects with AZ vaccine if they have	GB	0.0	Neutral
3 days after receiving a vaccine on a blinded trial, I get the official NHS text message saying I'm at the top of t… 	GB	0.2023	Positive
 I had AZ twice and I had no side effects at all.	GB	-0.296	Negative
 Yeah I’m worried about side effects, just as I’m busy and have Porter but other than that I’ve no apprehension 	GB	-0.7876	Negative
 Learning Ruby taught me how to structure my PHP code better. It encouraged me to learn about testing.Lea… 	GB	0.6597	Positive
    It is when 99% (probably 100%) are lying about side effects t… 	GB	-0.5267	Negative
 Afternoon! From what I've seen and heard, being properly hydrated really helps to ward off the side effects. Take care.	GB	0.7495	Positive
Fab Friday!  Excellent service #NHS  phlebotomy #MaryPotter health centre Investigation of… 	GB	0.7901	Positive
 Fit young soldiers that won't need medical attention, make a full recovery &amp; gain natural immunity don… 	GB	0.8126	Positive
 Wait ‘till you get the second one bro, I’ve heard that one’s worse with said side-effects. I better be p… 	GB	-0.0516	Negative
    no of course not... the woman who believes the BBC news and believes GO… 	GB	-0.296	Negative
   Oh I didn't see it, as your posting on a thread about people who know peopl… 	GB	0.0	Neutral
Just had my 1st #CovidVaccine and I feel absolutely fine! No side effects at all and did you know that you can now… 	GB	-0.1723	Negative
Just had my first #CovidVaccine and despite all of the concern and the wild conspiracy theories, I feel absolutely… 	GB	-0.5267	Negative
_mclennan   The VRAES Adverse vaccination reactions figures are absolutely shocking. Hu… 	GB	-0.6697	Negative
 _SpecialKay    _puligan … 	GB	0.0	Neutral
  We are never going to be able to vaccinate 8bn people, so the virus will always be around, abl… 	GB	0.0	Neutral
 I had no side effects after my mix	GB	-0.296	Negative
 Would you say that the AZ vaccine was the worst one for serious side effects...blood clots, blindness,… 	GB	-0.6597	Negative
One of the side effects of losing EU privileges in the UK, is that we now all see what non-EU people have always ha… 	GB	0.0	Neutral
After husband had his vaccine (astrazeneca) he was a bit unwell with side effects for a few days so I prepared myse… 	GB	0.3593	Positive
@_CarinaWh All vaccinations come with side effects. It’s how your body handles them. When a baby gets their vaccina… 	GB	0.0	Neutral
 My understanding is that the immune response to the vaccines is quite different to actual COVID (co… 	GB	0.296	Positive
Did anyone else have side effects to the #PfizerVaccine ? Had mine 2 days ago and literally feel like I've been hit by a bus.. #CovidVaccine	GB	0.3612	Positive
_Cottingham Thank you and I hope any side effects from yours are also short lasting.	GB	0.6597	Positive
Just had my first COVID vaccine. Barely felt anything and hoping for no side effects 	GB	0.1531	Positive
 Numbers are growing in side effects and deaths.I'm not going to instruct you on how to find out becau… 	GB	0.1779	Positive
_Cottingham Hopefully any side effects won't be too bas for you. Still trying to shake off the side effects from mine	GB	0.25	Positive
    Very much so. My point is even vaccines that are fully licenced are not 100%… 	GB	0.0	Neutral
     This is used at a different dosage with a di… 	GB	0.0	Neutral
    You know they can (and did) overlap, and much of the development work has be… 	GB	0.0	Neutral
Can confirm that side effects are an extreme desire to snack and watch TV.Also, I hoped this goofy joke will land… 	GB	0.7579	Positive
_Jane I’m here with you I’ve hyperemesis and I’ve barely been able to loved for months it’s awful. I feel… 	GB	0.2263	Positive
Thank you for this response ⁦⁩. Many severe #pwme have decided to try this despite the risk of side-eff… 	GB	0.1813	Positive
Had my 1st vaccine yesterday. So far no real side effects apart from not waking up until 11am 🤣	GB	-0.3566	Negative
i've been thinking abt this and unless they're severe why would u give a fuck what ur side effects are like awe i h… 	GB	-0.5574	Negative
Aching all over and want to go back to bed, when the doc tells you there aren’t really side effects from the vax don’t believe him	GB	-0.4404	Negative
_Treadwell Yay for fully vac’d up. Hope the side effects are milder this time.	GB	0.7624	Positive
Post first vaccine jab status : I am feeling great, no side effects whatsoever but I strongly recommend drink loads… 	GB	0.7964	Positive
 The truth is, these vaccinations are saving lives. The recent statistics prove that; I've had both jab… 	GB	0.3182	Positive
   Yikes, it's amazing, people who are younger are getting far more side effec… 	GB	0.5859	Positive
 _w I'll have to hurry back before the side effects kick in!	GB	0.0	Neutral
 Ah brilliant that you have a gig! Hope it goes well mate. Sure everyone will be up for a party. Jab wa… 	GB	0.92	Positive
 Working on getting over side effects of my vaccine and more gargants because you can never have too many tall Bois	GB	0.0	Neutral
Less Treatment for HPV-Related Oropharyngeal Cancer 	GB	-0.6597	Negative
  Still waiting to be called for my 2nd dose of jab. Had side effects off the 1st one reported to Doctor.	GB	0.0	Neutral
 Still collecting data from first doses - AZ side effects lasted some weeks in some and nothing in others… 	GB	0.0	Neutral
Getting covid vaccine before paper submission deadline is not fun at all. I don't have fever or any serious side ef… 	GB	-0.4592	Negative
I've have just booked my 1st COVID vaccine for tomorrow late afternoon. I'm happy and nervous at the same time! Hop… 	GB	0.4389	Positive
 Still really hurting, no other side effects though	GB	-0.6674	Negative
_graeme Wishing you a speedy cheerio to the side effects!	GB	0.5255	Positive
 Good Morning Dear Pipia! Sorry to hear you are having a few side effects from the vaccine! I’m sure it… 	GB	0.7955	Positive
 It is a relief Char xx I have mine on Sunday xx we didn’t have any side effects last time just had a fe… 	GB	0.4767	Positive
 No side effects here either!	GB	-0.3595	Negative
okay these covid vaccine side effects are no joke 	GB	0.2263	Positive
  35 MILLION jabs.Even one person with side effects is two too many, but perspective and scale is required	GB	0.0	Neutral
  I had AZ and had absolutely no side effects whatsoever, so everyone is different.	GB	-0.3597	Negative
I can deal with middle age, and my body suddenly deciding it wants to stop doing random vital things. But the side… 	GB	0.0	Neutral
I had AZ, and the first dose I had a headache that evening and slept poorly. Fine by morning, just tired. No other… 	GB	-0.5106	Negative
 Side effects knocking me about still.You?	GB	0.0	Neutral
Okay, my arm has started to hurt real bad  I hope this is it for me as far as side effects go because, no!	GB	-0.68	Negative
Finally have had my first dose. Hopefully no side effects. XxX ‍⚕️❤❤#CovidVaccine #GetVaccinated #StaySafe 	GB	0.128	Positive
Can't tell if that stress spike is vaccine side effects or just a good #Eurovision semi! 🤣 	GB	0.1007	Positive
_57 No chance walked straight out,  bollocks to that   felt fine no side effects whatsoever	GB	0.0772	Positive
@_TightWadBill Hmm strange. Didn't get side effects though this time which I guess was a positive.	GB	0.4215	Positive
If they have any concerns they should look at the real scientific evidence of harm to under 30s. More chance of sid… 	GB	-0.2975	Negative
 Triple mutant is a fancy way of saying vaccine side effects.	GB	0.0	Neutral
Let’s see what if any side effects there are from the 2nd jab! My immunity is suppressed already so 🤞🤞 there are none!	GB	0.0	Neutral
_Ball Ouch I’d wait for any side effects before hitting the pub!!! But feels good to be jabbed doesn’t it? 	GB	0.5826	Positive
_57 I felt no side effects whatsoever. I’m glad I took a newspaper.	GB	0.2023	Positive
_manners more the inconvenience of getting a jab than the side effects of getting a jab. reading about folk… 	GB	-0.4173	Negative
I don’t know if it’s the wine, vaccine side effects or what, but did that just happen? #POR #Eurovision	GB	0.0	Neutral
_Belle All good here too mate ta  Awww soz to hear it knocked you about also. I felt wiped out next day and… 	GB	0.4404	Positive
_xo I had the 2nd one I had side effects last weekend	GB	0.0	Neutral
 I was absolutely fine. Felt like I had been punched in the arm the day afterwards, but no other side effects for me	GB	-0.0955	Negative
       booked my ticket like an hour ago!… 	GB	0.4199	Positive
24 hours later definitely stronger side effects. Achey, tired and cold but definitely worth it.	GB	0.765	Positive
 Yeh thought id escaped any side effects	GB	0.0	Neutral
 I’m definitely improving, thank you. I’d hoped to skip the side effects second time round, but no such l… 	GB	0.3612	Positive
    _masiakos     … 	GB	0.0	Neutral
  We had to warm up Mums’s arms every time she had chemo as she didn’t have a PICC line (s… 	GB	0.2263	Positive
So far no side effects from the jab, apart from a very sore arm, so it’s time for a beer.	GB	-0.6453	Negative
A year ago today I was admitted to #QMCNottm with sepsis and a blood clot in my neck and brain. A year on things ar… 	GB	0.1027	Positive
17 signs of a blood clot that are easy to miss 	GB	0.3182	Positive
  The original AstraZeneca trials showed exceptional results when an initial half dose was… 	GB	0.3182	Positive
 The one thing the UK didn’t do with the Ox/Az vaccine was pause its roll out when they discovered the b… 	GB	0.0	Neutral
I love a conspiracy theory but am not sure what fucking weirdos think you can get a blood clot by being in the vici… 	GB	-0.6289	Negative
_57 To be fair, I got the blood clot shot, so it was probably good to get the blood pumping with a nice walk 	GB	0.7906	Positive
AZ experimental gene therapy has put my uncle in A+E with suspected blood clot, chest and back pain and possible lu… 	GB	-0.6369	Negative
  I’m really sorry to hear that. I hope your mum and friends recover as much as they can. My… 	GB	0.6605	Positive
  You have more chances of getting a blood clot from flying or from your birth control pills.	GB	0.2716	Positive
