Tweets	Country	Compound	Analysis
VACCINE UPDATE58,812 adult residents of the borough of Rugby have now had at least one dose of a Covid-19 vaccine… 	GB	0.0	Neutral
“many common persuasive styles —commanding, advising, lecturing &amp; shaming— not only don’t work but often backfire.… 	GB	0.0	Neutral
 Of course if you go by the data  993 in a 1000 recipients of the AZ vaccine have… 	GB	0.0	Neutral
Four in ten adults have received two #COVID19 jabs, Health Secretary Matt Hancock said.As of 20 May, 58,489,834 C… 	GB	0.0	Neutral
If you're aged 34 or over, or if you turn 34 before 1 July 2021, you can now book your COVID-19 vaccine. More inf… 	GB	0.0	Neutral
VACCINE UPDATE - 20 May 2021 85,085 residents of Stratford-on-Avon District have now had at least one dose of a C… 	GB	0.0	Neutral
 City GP Dr Anup Singh is calling on people in Nottingham to protect themselves against Covid-19“My message to y… 	GB	0.3818	Positive
Anyone who is aged 36 or over - or if you turn 36 before 1 July 2021 - can now book your #COVID19 vaccine.Getting… 	GB	0.0	Neutral
NHS England has announced people aged 34 and over can now book their COVID vaccine.This also includes people who… 	GB	0.0	Neutral
You can now book your COVID-19 Vaccine if you are aged 34 or over before 1st July 2021 	GB	0.0	Neutral
"""Nick Saban: ‘Please get your COVID-19 vaccine’"" "	GB	0.0	Neutral
‼️￼￼￼ If you’re aged 40-49 and haven’t had your covid-19 vaccine yet you no longer need to book an appointment … 	GB	-0.296	Negative
Covid ‘booster’ trial will give third vaccine dose to UK volunteers 	GB	0.0	Neutral
Drop in Covid-19 vaccination clinic today for residents of Saffron, Eyres Monsell and New Parks until 8pm Find… 	GB	-0.2732	Negative
Every vaccination gives us hope.  Join the millions already vaccinated, to protect yourself and others.  Find o… 	GB	0.7717	Positive
Are you aged between 34 and 39? You can now book your Pfizer COVID-19 vaccine at Stoneleigh by calling 119 or go to… 	GB	0.0	Neutral
The #CovidVaccine will protect you against serious illness from Covid-19 but you need to have your second dose for… 	GB	-0.0516	Negative
The Covid-19 pandemic is a global problem that requires a global solution. This means finding a way to ramp up vacc… 	GB	-0.1027	Negative
  Looks good to me.	GB	0.4404	Positive
If you're aged 34 or over, or if you turn 34 before 1 July 2021, you can now book your COVID-19 vaccine.Book your… 	GB	0.0	Neutral
Over 34s, or those who turn 34 before 1 July 2021, are now eligible for a #COVID-19 vaccine. You can find out how t… 	GB	0.0	Neutral
The Covid-19 vaccine is the best way to protect yourself from the virus.Don’t delay in getting your vaccine when… 	GB	0.6705	Positive
Age limit for vaccines is dropping really quickly …. now 34 and above. your vaccine &amp;… 	GB	0.0	Neutral
 More than 70% of adults in the UK have now had their first dose of the #COVID19 vaccine.Thank you to everyone w… 	GB	0.0	Neutral
 I don't understand the link between Olympic and Japan's COVID-19 situation. Instead, it's because Japa… 	GB	0.0	Neutral
 If you're aged 34 or over, or if you turn 34 before 1 July 2021, you can now book your COVID-19 vaccine.❤ And i… 	GB	0.0	Neutral
Full disclosure: in 2002 I received a rabies vaccination from the NHS for free (in error). Have felt guilty about t… 	GB	0.128	Positive
Vaccinations | The booking service is now available to people aged 34 &amp; overBooking is quick &amp; simple via: … 	GB	0.0	Neutral
You can now book your covid-19 vaccine if you are 34 and over via the NHS site. Over 30 twitter it’s your time to s… 	GB	0.0	Neutral
If you are aged 34+ please book your vaccine as soon as possible; you can book online or by calling 119… 	GB	0.3182	Positive
If you’re aged 34 or over, or if you turn 34 before 1 July 2021, you can now book your COVID-19 vaccine.… 	GB	0.0	Neutral
Vaccines have been through rigorous testing. processes. When you’re called to book yours, please be assured that th… 	GB	0.4019	Positive
‼️ The vaccination booking service is now open to people over the age of 34⌨️ Visit:  C… 	GB	0.0	Neutral
The world’s first clinical trial looking at seven different COVID-19 booster vaccines has begun in the UK, with ini… 	GB	0.0	Neutral
Every #vaccination gives us hope. Join the millions already vaccinated against #Covid19.You need two doses for ma… 	GB	0.6249	Positive
People aged 34 or over can now book their vaccine online #GetVaccinated 	GB	0.0	Neutral
   matey!	GB	0.0	Neutral
Look at that arm.... lucky Kate! Prince William receives his first dose of the Covid-19 vaccine  via 	GB	0.4753	Positive
Prince William receives his first vaccine dose after contracting Covid last year via 	GB	0.0	Neutral
People aged 34 and over can book their Covid-19 jab from today	GB	0.0	Neutral
COVID-19: Vaccine rollout extended for second time this week as 34 and 35 -year-olds in England can get the jab | U… 	GB	0.0	Neutral
NEWS: Vaccine rollout extended for second time this week as 34 and 35 -year-olds in England can get the jab 	GB	0.0	Neutral
❗️❗️ If you're aged 3⃣4⃣ or over, or if you turn 34 before 1 July 2021, you can now book your COVID-19 vaccine. … 	GB	0.0	Neutral
"#Britain's vaccination programme is to be given a ""turbo-boost"" in a “race” to vaccinate its population in order to… "	GB	0.0	Neutral
This vaccine is more deadly than covidVaccine Safety Update  via _Sceptics	GB	0.4215	Positive
If you’re aged 36 or over, or if you turn 36 before 1 July 2021, you can now book your COVID-19 vaccine.Book your… 	GB	0.0	Neutral
The vaccine protects you and those around you ‍‍‍Join the millions already vaccinated You will be informed… 	GB	0.3182	Positive
NEWS | NHS England has confirmed the million-plus people aged 34 and 35 will receive a text message today or tomorr… 	GB	0.0	Neutral
 34 and 35 year olds can now book in for their #coronavirus #vaccine BOOK HERE:  	GB	0.0	Neutral
Vaccine rollout extended for second time this week as 34 and 35 -year-olds in England can get the coronavirus jab 	GB	0.0	Neutral
COVID-19: Michael Gove is visiting Israel to study the “Green Pass” of a country considering vaccine passport optio… 	GB	0.0	Neutral
I reckon this may be the straw that breaks the camels back for a lot of people. We have had the largest vaccination… 	GB	0.0	Neutral
     Can you explain why the site says you need to be 84 days… 	GB	0.0	Neutral
The hoarding of resources seen with the Covid-19 vaccine apartheid &amp; prioritising of some lives over others is a mi… 	GB	0.0	Neutral
If you have been in a country on the UK's Green List in the last 10 days, you will need to take a Day 2 PCR test up… 	GB	0.0	Neutral
Got my 1st COVID-19 vaccine booked for Monday.	GB	0.0	Neutral
That’s my second covid 19 vaccine complete . 	GB	0.0	Neutral
Live Covid News Updates: India, Vaccines, Masks and Reopening - The New York Times 	GB	0.0	Neutral
Vaccination teams in #Derbyshire have reached a major milestone after administering one million covid-19 vaccine do… 	GB	0.1027	Positive
Over the age of 30? Received your first  vaccination against COVID-19 in December 2020 or January 2021?Why not loo… 	GB	0.0	Neutral
Health Secretary  has announced a clinical trial looking at COVID-19 vaccine booster jabs. Birmingham i… 	GB	0.0	Neutral
The first dose of #COVID19 vaccine offers a high level of protection, but to get longer-lasting protection everyone… 	GB	0.0	Neutral
If you had your first covid vaccine 8 weeks ago or more you can book your second dose online now. Had mine today, h… 	GB	0.0	Neutral
BREAKING: Volunteers from the West Midlands will soon be able to receive a third ‘booster’ COVID-19 vaccine through… 	GB	0.0	Neutral
I've always been proud of my dad but today was a little bit extra because he managed to influence most of his frien… 	GB	0.2617	Positive
Thank you for the clarity. #AstraZeneca 	GB	0.6369	Positive
A bit more reassuring #AstraZeneca 	GB	0.4576	Positive
AstraZeneca chief hits back at ‘armchair generals’ after criticism 	GB	-0.4404	Negative
This is your #vaccination station #AstraZeneca Round 2! 	GB	0.0	Neutral
    That and a govt that listen to 	GB	0.0	Neutral
1st May 2021 AstraZeneca jabbed into my left upper arm muscle more like a glass bottle over the head to a threat or… 	GB	-0.1548	Negative
Second dose booked!  #CovidVaccine #AstraZeneca 	GB	0.0	Neutral
Double shift this morning volunteering at my GP’s vaccine clinic. Most ambitious single day target here since this… 	GB	0.5256	Positive
AstraZeneca chief says ‘vaccine has a future’ after setbacks 	GB	0.0	Neutral
2nd Jab done ✔️#AstraZeneca #nhs #grateful	GB	0.0	Neutral
My mom had the #AstraZeneca vaccine and 2 weeks later was rushed to Heartlands hospital with blood clots on her lun… 	GB	0.0	Neutral
The 2 doses of AstraZeneca,hayfever tablet and can of monster ultra in my bloodstream rn: 	GB	0.0	Neutral
Wow - this is a really exciting online event coming up in July #AstraZeneca #Vaccine #BlackwellsEvents 	GB	0.807	Positive
How many people around the world owe their lives to AstraZeneca and the UK tax payer? What a beautiful amazing and… 	GB	0.8271	Positive
Just had my second vaccine  feel privileged. Thank you to all the scientists, AstraZeneca (in my case) and #NHS	GB	0.6597	Positive
  only matters so much if you're driving, in case you go a bit funny? I got astrazeneca at a vax hub fwiw	GB	0.4588	Positive
Fully vaccinated! Yay! #AstraZeneca 	GB	0.6442	Positive
My second jab. And, as I’m wearing a mask, please take it from me that I’m grinning from ear to ear. Thanks… 	GB	0.5859	Positive
 My friends in hospital with a stroke.AstraZeneca. She went downhill after first jab.Doctor actually… 	GB	0.4767	Positive
Fully vaccinated. Thank you   	GB	0.4173	Positive
2nd dose of nanobots administered this evening.  Fuck you Covid-19 #AstraZeneca #NHSCOVIDVaccine 	GB	-0.5423	Negative
Today I’m feeling quietly elated at having received my second vaccine. I respect vaccination is personal choice but… 	GB	0.8316	Positive
I'm now a member of the greatest club in the World (at the moment) ♥️ #FullyVaccinated #COVID19 #AstraZeneca… 	GB	0.6369	Positive
  That's the AstraZeneca isn't it? I thought I would be having that one, but with the chan… 	GB	0.0	Neutral
   I wish we had the right over own our body sadly my surgeon went to prison for do… 	GB	-0.5267	Negative
Prince William receives first dose of Covid vaccine As William is under 40, he will have been entitled to choose wh… 	GB	0.2732	Positive
So efficient at Cirencester hospital! Arrived, vacccinated  (2nd AstraZeneca) and out the door in less than 2 minutes! 	GB	0.5686	Positive
 Two elderly relatives had two Pfizer jabs each, no ill effects at all. I had AstraZeneca, felt slig… 	GB	-0.6124	Negative
Received 2nd #AstraZeneca jab this morning. #shieldsup #covid19	GB	0.0	Neutral
  Probably only the equivalent of 22p with the shares issued in the interim, but potential… 	GB	0.1531	Positive
 _ If it's AstraZeneca than the first jab is notoriously much worse than the second. If it'… 	GB	-0.4767	Negative
   Yes very well thank you.  lol #Gloshour	GB	0.8648	Positive
   Hopefully you'll be fine! Myself and a few friends all had the astrazeneca… 	GB	0.784	Positive
A mix-and-match vaccine study suggests one shot of AstraZeneca followed by one shot of Pfizer is effective 	GB	0.4767	Positive
#AskTheCEO  will you suspend your vaccine patents, and share technology &amp; know-how to ensure that every… 	GB	0.3612	Positive
 I had AstraZeneca so did Uncle M. I had sore arm for a couple days but ok otherwise. I haff my 2nd tomorrow	GB	0.2617	Positive
_ Problem is that some people won't know that had covid, did read a story that said people that have an… 	GB	-0.4019	Negative
 I wish I could go back 19 days to vaccination day and say No.One of worst decisions of my life.12… 	GB	-0.34	Negative
Fully vaccinated! #AstraZeneca 	GB	0.0	Neutral
hot girl summer 2021 is being brought to you by astrazeneca and azzalure xo 	GB	0.0	Neutral
 M&amp;D both had Oxford AstraZeneca one (2nd dose due next week). Both had mild flu-like symptoms for a s… 	GB	0.0	Neutral
FSRH press release: FSRH issues updated guidance on use of combined hormonal contraception, the Astra Zeneca COVID-… 	GB	0.0	Neutral
Spain approves Pfizer shots for under-60s who got AstraZeneca first dose -El Pais 	GB	0.4019	Positive
Worth reading if you had the AstraZeneca jab.Be safe. 	GB	0.5859	Positive
This is brilliant news.. #GetVaccinated #AstraZeneca 	GB	0.5859	Positive
So, after getting reassurance from my GP today, I will now be getting my second AstraZeneca Covid vaccine later thi… 	GB	0.4144	Positive
 Experience of volunteering at the vax centres is that they have had to do a bit of a sudden handbrak… 	GB	0.0	Neutral
Higher risk associated with #AstraZeneca #vaccine than from #COVID-19 disease in Norway say the Norwegian health au… 	GB	-0.2732	Negative
Twitter flag another tweet as misleading, obviously true then #AstraZeneca #vaccine 	GB	0.0258	Positive
Got my second dose today along with a little souvenir! So lucky to have our amazing NHS #GetVaccinated #AstraZeneca… 	GB	0.7858	Positive
Welcome me to the fully vaccinated club #AstraZeneca #vaccinated #NHSCOVIDVaccine 	GB	0.4588	Positive
Just had my second AstraZeneca vaccine  please do get your vaccine when it’s ready for you. Everyone’s health is v… 	GB	0.5859	Positive
_Hall 🥳 How are you feeling today? Hoping to avoid the AstraZeneca manflu that struck down hubby lol	GB	0.4404	Positive
     Brilliant	GB	0.5859	Positive
Time for other vaccine makers to follow Oxford/AstraZeneca’s lead 	GB	0.0	Neutral
 Bang on the money with the helpful links/tweets as usual!(Brought my 2nd jab forward 8 days to sat pm-… 	GB	0.4753	Positive
Fair play, my 2nd jab has indeed be brought forward by 3 weeks. #COVID19 #AstraZeneca	GB	0.5719	Positive
     Eyy. Congratulations!	GB	0.636	Positive
 Molly's had 2 now AstraZeneca shes 22 and was ok ❤ hope you are all well xx	GB	0.7351	Positive
   Any blatant lies in it ?!?!  “Three times the cases in Pakistan and Banglade… 	GB	-0.5781	Negative
   World beating .... againShame about the #BorisVariant #JohnsonVariant undo… 	GB	-0.4588	Negative
Life is not good right now.I should be happy I survived 12 years ago escaping being a murder statistic.I'm figh… 	GB	0.0243	Positive
Had my second covid vaccine #covid #AstraZeneca #FullyVaccinated #Covid_19 #fuckcovid 	GB	0.0	Neutral
Well thats me 2nd jab done #AstraZeneca stay sfe all 	GB	0.2732	Positive
 The only difference in the way they administer the jab seems to be that with Astrazeneca you don’t… 	GB	0.0	Neutral
second dose of AstraZeneca has gave me the same side effects as the first dose 🥴🥴🥴 obviously worth it in the long r… 	GB	0.2263	Positive
#vaccine #AstraZeneca Clapton feared he would never play again. 	GB	-0.6412	Negative
     Pretty damm sure that the Titanic didn't sink because the… 	GB	0.6705	Positive
Had my second dose of Astrazeneca yesterday. After my first dose, was on my back for two days with a nasty headache… 	GB	-0.5574	Negative
  You might want to read and watch this video 	GB	0.0772	Positive
 could you please put a light on ? When the 2nd doses gonna administered by the moh for those who have alr… 	GB	0.3182	Positive
A very, very emotional hug with her gran this morning. They've both had two vaccine doses but a mask for extra good… 	GB	0.4417	Positive
 any news about second dose of Astrazeneca for those who already took the first dose	GB	0.0	Neutral
   Yup I had AstraZeneca as my first	GB	0.0	Neutral
_body_art     No it hasn’t.	GB	-0.296	Negative
 I'm one of your constituents I've been seriously poisoned by  the  campaign is not… 	GB	-0.5994	Negative
 The objections to the AstraZeneca vaccine were part of the vicious, anti UK campaign by the EU.	GB	-0.5859	Negative
AstraZeneca vaccine is 97 per cent effective against India strain says new Covid study 	GB	0.4404	Positive
2nd jab done - thanks to fab staff at  vaccination centre #COVIDVaccination #AstraZeneca 🥰 	GB	0.7096	Positive
  More chance of dying from the side effects of AstraZeneca for U30 than covid 	GB	0.3167	Positive
The centre also offers the Oxford AstraZeneca vaccination for people 40 and over or Rugby residents can book a vacc… 	GB	0.0	Neutral
So grateful to have received my second COVID jab - thanks to all involved   @ Dar… 	GB	0.7346	Positive
   Fantastic hope to have my 2nd one soon too 	GB	0.7579	Positive
      Fantastic - well done!	GB	0.7177	Positive
      Congratulations! That’s great news 	GB	0.8516	Positive
Yay I’m fully vaccinated. How my second jab went  #needlephobia #fullyvaxxed	GB	0.5267	Positive
just got the second dose of the AstraZeneca vaccine!!!!! fully vaccinated baby!!!!!!!!!	GB	0.0	Neutral
      Amazing, congratulations!	GB	0.8398	Positive
  Wasn’t it said there would be no mixing of vaccine as yet beca the hadn’t done the research a… 	GB	-0.296	Negative
  _Glitter   Now where does it say the danger is just t… 	GB	-0.5267	Negative
 My son is 25 &amp; vunerable so was given AstraZeneca.  Still to have his 2nd but AZ is now not to be given to und… 	GB	0.0	Neutral
 _Glitter   AstraZeneca isn’t safe for u30 yet this government is… 	GB	0.4404	Positive
   Or you’re being forced the 2nd AstraZeneca dose which you have more chance… 	GB	-0.4588	Negative
Give me an alternative then  not the AstraZeneca one that for U30’s got more chance of dying from it t… 	GB	0.3167	Positive
_TA       … 	GB	0.0	Neutral
I am now fully vaccinated. My experience of my second dose of AstraZeneca wasn't quite like the first however.… 	GB	-0.3241	Negative
So, I'm due to have my second AstraZeneca vaccine this coming week.But, I am currently under a specialist at… 	GB	0.0	Neutral
Just had a call from the vaccine centre where I had my first jab, asking if I'd like to bring my second jab forward… 	GB	0.3612	Positive
 _Aflatoon _Dialogue_   _t _sri   Doe… 	GB	0.0	Neutral
_Umar    now it is a time to spare some time for ovs pakis, allow private co… 	GB	0.2263	Positive
Indian variant could lead to under 40s getting AstraZeneca jab again: 	GB	0.0	Neutral
Is the problem with the vaccine more to do with variations/defects in production &amp; not the base technology/recipe?… 	GB	-0.4019	Negative
Pfizer and AstraZeneca vaccines says work against The Indian Variant. So please if you are eligible for vaccines pl… 	GB	0.3804	Positive
I dah tick my side effect symptoms after vaccine #CucukMyAZ #AstraZeneca #COVID19Vaccination #Mysejahtera… 	GB	0.0	Neutral
 #NBI #EQLS #GILD #AZN #MRK #VTY #BDEVYes - Healthcare &amp; housebuilders Here I own… 	GB	0.0	Neutral
 I demamd to know why am I not glowing in the dark yet??? 	GB	0.0	Neutral
So you are young? Think covid is an old people problem? Anti vaccine? Looking forward to a holiday etc? Stop being… 	GB	-0.6662	Negative
 Astrazeneca and J&amp;J vaccines use a modified virus, adenovirus, to infect the cells and causes that cel… 	GB	0.0	Neutral
2nd jab received this morning. Well done to the superb team at #Didcot Civic Centre. #AstraZenecaAnd round of app… 	GB	0.7351	Positive
I finally might be able to get a vaccine (AstraZeneca).	GB	0.0	Neutral
Vaccination staff are ready for you at  There’s a large car park to the rear of the building and the cl… 	GB	0.3612	Positive
First dose of Pfizer    #CovidVaccine #altrincham #NHS 	GB	0.0	Neutral
Could literally feel bill gates microchip being inserted and my DNA instantly being amended...  #Pfizer #vaccine… 	GB	0.0	Neutral
Looks like some encouraging news #Coronavirus #CoronavirusUK #CoronavirusWales #Covid19 #Covid19UK #Covid19Wales 	GB	0.7096	Positive
Getting my first Pfizer vaccine today 🥺	GB	0.0	Neutral
_Hindu Those promoting Pfizer have been getting healthy perks / favours from this pharma giant! Without any doubt...	GB	0.807	Positive
 Which one did you get? I had AZ and Mark had Pfizer, but we both felt pretty rubbish for 24 hours after.	GB	0.6486	Positive
 Then why does it mention shedding in the Pfizer documents?	GB	0.0	Neutral
  I had Pfizer and sore arm, headache and general bleurgh after the first one for a cou… 	GB	-0.3612	Negative
 I knew it had been offered by Pfizer/IOC but BOA hadn't confirmed it would go ahead until today.	GB	0.0	Neutral
 _adw50  Research Dr Reiner Fuellmich for names, too late for me to do your homewor… 	GB	0.0	Neutral
 I was the same with Pfizer. A slightly sore shoulder, but that was it.	GB	-0.154	Negative
_adw50   Point is I’m not antivax - I am provax for the vulnerable. They’ve all bee… 	GB	-0.2263	Negative
  _adw50  With 10,000 worldwide doctors to back him up .... includi… 	GB	0.0	Neutral
 Did you get the AZ or Pfizer?	GB	0.0	Neutral
_oV  They seem to be doing Pfizer - I had mine today and it was Pfizer yesterday too.	GB	0.0	Neutral
_7_00 Which one you have mate? I was 100% after the Pfizer one.	GB	0.0	Neutral
Thanks to all the scientists who made this happen - and to all their families for enabling them to work long hours… 	GB	0.4404	Positive
Fuckin hell pfizer has given me the biggest dead arm ever	GB	-0.872	Negative
⚠️Help stop the spread of #Covid19 - if you've not had your first vaccine already, visit one of our extra #Pfizer c… 	GB	-0.296	Negative
Get ready to make use of the extra 1st dose Pfizer vaccine clinics we're running this weekend_rys from… 	GB	0.3612	Positive
 Ooh very saucy  Can imagine this - pfizer or AZ? First or second? Sore arm? 🤣	GB	-0.466	Negative
 check local facebooks! my sister noticed their was a walk in clinic not far from me. came this morning an… 	GB	0.0	Neutral
Can we make 'pint of tizer' the cockney rhyming slang for 'just had my Pfizer'?	GB	0.0	Neutral
  It says three people died of diarrhoea after the Pfizer jab	GB	-0.5574	Negative
 Yesssss join the Pfizer gang	GB	0.296	Positive
IT WORKED!! pfizer gang I have arrived	GB	0.0	Neutral
 I had the Pfizer. Brilliant except just an ache in my arm xx	GB	0.296	Positive
_ninal  You need to be registered with a Rochdale GP. Yes this weekend they are all Pfizer vaccines… 	GB	0.4019	Positive
⚠️#Pfizer first dose jabs this weekend. Anyone 18+ registered with a #Rochdale GP can attend: Wardleworth Community… 	GB	0.0	Neutral
  Pfizer can't be stored. If there's spare capacity, walk-ins are invited. It's all v… 	GB	0.0	Neutral
 I had a mix of vaccines Astra 1st but they should not have been given cos of the contraindication wit… 	GB	0.0	Neutral
What a week! I’ve learnt so much already. Lovely feedback from patients, watched a pacemaker procedure, PICC line a… 	GB	0.6548	Positive
Im assuming its botox injection? 	GB	0.0	Neutral
 Could I use your expertise to ask what are my chances of severe illness or death after already having… 	GB	-0.8126	Negative
 Don’t worry, I’ve had both of my jabs. Soreness at the injection site (just like the flu jab) but no other after-effects.	GB	-0.5859	Negative
Booked in for the Indian variant injection tomorrow, glad I’m getting the Punjab 	GB	0.4588	Positive
 I think that the injection may prevent some deaths but not catching the infection so hopefully hospita… 	GB	0.6991	Positive
Heavens! South Carolina death row inmates must now choose between electric chair and firing squad if lethal injec… 	GB	-0.5983	Negative
 The injection site will likely become sore after sometime. I experienced fever with chills and head… 	GB	-0.3612	Negative
no and i am 53 and still can not get a covid injection i have tried and tried and been told i have to wait to be told to get one x	GB	-0.296	Negative
#TimBrooks read recipt I will not be meating with u dr as part of my political protest against my detainment unlawf… 	GB	-0.25	Negative
Bed time! Early start at work tomorrow, and later on, I get my second vaccine injection.... #excited! :D	GB	0.6825	Positive
    Just missing a cash injection  🤷‍♂️	GB	-0.296	Negative
#KidsTtimechat“If someone is giving you an injection do you:-	GB	0.34	Positive
  Good for military future, so many bodge done to ensure still moving at endex. Many a Chi… 	GB	0.6705	Positive
 Maybe people should be able to choose if they wear a mask have an injection, etc but what many don’t t… 	GB	0.0	Neutral
_Me  When you go in tell them you go dizzy after an injection. That way they will give y… 	GB	-0.2263	Negative
Last night seeing this little legends mum for her injection. This baby is so cute.  I’ve blessed him a thousand tim… 	GB	0.8414	Positive
 Chinese president the only justice here is for your family bro be hang the lethal injection is not for an… 	GB	0.5267	Positive
 I eye roll &amp; tut, I’m not at the lethal injection stage yet 	GB	0.0	Neutral
New paper in   - Enhanced Spin Injection in Molecularly Functionalized Graphene via Ultr… 	GB	0.0	Neutral
ENGEL supports the future of the Irish plastics sector by providing First Polymer Training Skillnet with an injecti… 	GB	0.3612	Positive
Can’t believe am one injection away from being able to taste the railings at train stations again🥰🥰	GB	0.0	Neutral
"""I'm a bit nervous like I would be for any injection but looking forward to knowing that I've got some protection""… "	GB	0.0516	Positive
These tax credits provide an often vital cash injection for businesses which can be invested in accelerating projec… 	GB	0.5719	Positive
 True story I do worry for Ole that he won’t get the injection of cage he needs this summer to improv… 	GB	-0.0258	Negative
Webinar: Life extension of rigid and flexible pavements using geopolymer injection technology.Register here:… 	GB	0.1027	Positive
The #LONGEVITY project is designed implement preclinical and clinical long-acting injectable product development fo… 	GB	0.0	Neutral
